{
  "run_id": "squeezenet1_1__adam__seed42",
  "model": "squeezenet1_1",
  "split": "test",
  "accuracy": 0.9422222222222222,
  "macro_precision": 0.9398880994495519,
  "macro_recall": 0.9392444444444443,
  "macro_f1": 0.9393817837671611,
  "weighted_precision": 0.9425258510158625,
  "weighted_recall": 0.9422222222222222,
  "per_class": {
    "AnnualCrop": {
      "precision": 0.9336283185840708,
      "recall": 0.9377777777777778,
      "f1": 0.9356984478935698,
      "support": 450
    },
    "Forest": {
      "precision": 0.9800443458980045,
      "recall": 0.9822222222222222,
      "f1": 0.9811320754716981,
      "support": 450
    },
    "HerbaceousVegetation": {
      "precision": 0.9329004329004329,
      "recall": 0.9577777777777777,
      "f1": 0.9451754385964912,
      "support": 450
    },
    "Highway": {
      "precision": 0.8545454545454545,
      "recall": 0.8773333333333333,
      "f1": 0.8657894736842106,
      "support": 375
    },
    "Industrial": {
      "precision": 0.9603174603174603,
      "recall": 0.968,
      "f1": 0.9641434262948207,
      "support": 375
    },
    "Pasture": {
      "precision": 0.9180327868852459,
      "recall": 0.9333333333333333,
      "f1": 0.9256198347107438,
      "support": 300
    },
    "PermanentCrop": {
      "precision": 0.8891891891891892,
      "recall": 0.8773333333333333,
      "f1": 0.8832214765100671,
      "support": 375
    },
    "Residential": {
      "precision": 0.977924944812362,
      "recall": 0.9844444444444445,
      "f1": 0.9811738648947951,
      "support": 450
    },
    "River": {
      "precision": 0.9567723342939481,
      "recall": 0.8853333333333333,
      "f1": 0.9196675900277008,
      "support": 375
    },
    "SeaLake": {
      "precision": 0.9955257270693513,
      "recall": 0.9888888888888889,
      "f1": 0.992196209587514,
      "support": 450
    }
  },
  "confusion_matrix": [
    [
      422,
      1,
      0,
      4,
      0,
      6,
      16,
      0,
      1,
      0
    ],
    [
      0,
      442,
      3,
      0,
      0,
      2,
      0,
      0,
      2,
      1
    ],
    [
      0,
      2,
      431,
      2,
      0,
      4,
      9,
      1,
      1,
      0
    ],
    [
      9,
      0,
      2,
      329,
      6,
      4,
      13,
      2,
      10,
      0
    ],
    [
      0,
      0,
      0,
      4,
      363,
      0,
      1,
      6,
      1,
      0
    ],
    [
      3,
      3,
      7,
      4,
      0,
      280,
      2,
      0,
      0,
      1
    ],
    [
      9,
      1,
      16,
      13,
      3,
      3,
      329,
      1,
      0,
      0
    ],
    [
      0,
      0,
      2,
      0,
      5,
      0,
      0,
      443,
      0,
      0
    ],
    [
      7,
      2,
      0,
      29,
      1,
      4,
      0,
      0,
      332,
      0
    ],
    [
      2,
      0,
      1,
      0,
      0,
      2,
      0,
      0,
      0,
      445
    ]
  ],
  "class_names": [
    "AnnualCrop",
    "Forest",
    "HerbaceousVegetation",
    "Highway",
    "Industrial",
    "Pasture",
    "PermanentCrop",
    "Residential",
    "River",
    "SeaLake"
  ],
  "num_samples": 4050,
  "evaluated_utc": "2026-10-14T20:39:41+00:00",
  "checkpoint": "artifacts/checkpoints/squeezenet1_1__adam__seed42/best.pt"
}
